{
  "schema_version": "1.0",
  "experiment_id": "load_bearing_prose_test_scaffold",
  "hypothesis": "The deterministic obligation-shape extractor plus the delete/negate/paraphrase ablation transforms produce byte-stable, digest-round-trippable receipts on the frozen fixture plans, providing the scaffolding required for the Week-2 executor adapter and scoring rules.",
  "claim_tier": "descriptive",
  "controls": [
    {
      "control_id": "rule_based_extractor",
      "description": "Rule-based obligation-shape extractor runs deterministically over both CT task-family fixtures without live-provider calls."
    },
    {
      "control_id": "atomic_ablation_transforms",
      "description": "Delete, negate, and paraphrase transforms apply exactly once per matched modal via an atomic-alternation regex so no round-trip erases the ablation."
    }
  ],
  "seeds": [20260721],
  "runtime": {
    "execution_class": "local_cpu",
    "command": ["python3", "-m", "experiments.load_bearing_prose_test.run_lbpt_smoke"],
    "estimated_minutes": 1,
    "max_cost_usd": 0
  },
  "dependencies": [],
  "gates": [
    {
      "gate_id": "EXTRACTOR_DETERMINISTIC",
      "criterion": "The rule-based extractor returns identical ClaimBundle digests across repeated runs on the frozen fixtures."
    },
    {
      "gate_id": "ABLATION_ROUND_TRIP",
      "criterion": "Every claim yields exactly one delete, one negate, and one paraphrase ablation with a distinct modified-plan digest."
    },
    {
      "gate_id": "SMOKE_BYTE_STABLE",
      "criterion": "results/summary.json regenerates byte-for-byte from the frozen fixtures at seed 20260721."
    }
  ],
  "artifacts": [
    {
      "kind": "summary",
      "path": "experiments/load_bearing_prose_test/results/summary.json",
      "public": true
    },
    {
      "kind": "summary",
      "path": "experiments/load_bearing_prose_test/results/pilot/summary.json",
      "public": true
    },
    {
      "kind": "dataset",
      "path": "experiments/load_bearing_prose_test/results/pilot/rows.jsonl",
      "public": true
    },
    {
      "kind": "other",
      "path": "experiments/load_bearing_prose_test/PREREGISTRATION.md",
      "public": true
    },
    {
      "kind": "other",
      "path": "docs/harness_research/load_bearing_prose_test/README.md",
      "public": true
    },
    {
      "kind": "other",
      "path": "docs/harness_research/load_bearing_prose_test.md",
      "public": true
    }
  ],
  "status": "planned"
}
