{
  "schema_version": "1.0",
  "experiment_id": "commitment_surface_m5_suite_c_reopen_reset_trigger",
  "hypothesis": "A reopen-reset trigger is strictly superior to matched Suite C controls under the frozen M5 gates.",
  "claim_tier": "internal",
  "controls": [
    {
      "control_id": "t_commit",
      "description": "Commitment-surface control trigger family."
    },
    {
      "control_id": "t_util",
      "description": "Utility control trigger family."
    },
    {
      "control_id": "t_norm",
      "description": "Normalized control trigger family."
    },
    {
      "control_id": "t_periodic",
      "description": "Periodic control trigger family."
    },
    {
      "control_id": "t_none",
      "description": "No-trigger floor control."
    }
  ],
  "seeds": [
    20260709,
    20261712,
    20262715,
    20263718,
    20264721,
    20265724,
    20266727,
    20267730
  ],
  "runtime": {
    "execution_class": "local_cpu",
    "command": [
      "uvx",
      "--python",
      "3.12",
      "--with",
      "numpy",
      "python",
      "-m",
      "experiments.world_responds.suite_c_reopen_reset_trigger",
      "--seeds",
      "20260709,20261712,20262715,20263718,20264721,20265724,20266727,20267730",
      "--out",
      "artifacts/world_responds/m5_suite_c_reopen_reset_trigger_2026_07_14.json",
      "--summary-json",
      "experiments/commitment_surface/results/m5_suite_c_reopen_reset_trigger_2026_07_14.json",
      "--summary-md",
      "experiments/commitment_surface/results/m5_suite_c_reopen_reset_trigger_2026_07_14.md"
    ],
    "estimated_minutes": 30
  },
  "dependencies": [
    {
      "name": "numpy",
      "version": ">=1.26,<2.2"
    }
  ],
  "gates": [
    {
      "gate_id": "F0_INTEGRITY",
      "criterion": "Integrity receipt and exact cell inventory pass."
    },
    {
      "gate_id": "F1_COMMIT_8_OF_8",
      "criterion": "Commitment trigger wins all eight seed cells."
    },
    {
      "gate_id": "F2_LATENCY_DOMINANCE",
      "criterion": "Latency dominance over matched controls."
    },
    {
      "gate_id": "F3_SPECIFICITY",
      "criterion": "Normalized-trigger specificity passes."
    },
    {
      "gate_id": "F4_JOINT_NON_DOMINATION",
      "criterion": "Joint non-domination gate passes."
    },
    {
      "gate_id": "F5_NONE_FLOOR",
      "criterion": "No-trigger floor remains below the reopen-reset trigger."
    }
  ],
  "artifacts": [
    {
      "kind": "summary",
      "path": "experiments/commitment_surface/results/m5_suite_c_reopen_reset_trigger_2026_07_14.json",
      "public": true
    },
    {
      "kind": "paper",
      "path": "experiments/commitment_surface/results/m5_suite_c_reopen_reset_trigger_2026_07_14.md",
      "public": true
    }
  ],
  "status": "rejected"
}
